{"name":"seed0_x016_z020.scene.json","userData":{"jcrpg":{"schemaVersion":2,"worldId":"seed0-web-v2","key":"16:20","chunk":[16,20],"bounds":[512,0,640,544,80,672],"generatorVersion":"web-baked-v2","terrain":{"heights":[39,39,39,39,40.21428680419922,40.21428680419922,40.21428680419922,40,40,40.28571319580078,40.28571319580078,40.28571319580078,40,40,40.400001525878906,40.400001525878906,40.400001525878906,39,39,39,39,40.21428680419922,40.21428680419922,40.21428680419922,40,40,40.28571319580078,40.28571319580078,40.28571319580078,40,40,40.400001525878906,40.400001525878906,40.400001525878906,39,39,39,39,40.21428680419922,40.21428680419922,40.21428680419922,40,40,40.28571319580078,40.28571319580078,40.28571319580078,40,40,40.400001525878906,40.400001525878906,40.400001525878906,39,39,39,39,40,40,40,40.485713958740234,40.485713958740234,40.24285888671875,40.24285888671875,40.24285888671875,40.97142791748047,40.97142791748047,40,40,40,39,39,39,39,40,40,40,40.485713958740234,40.485713958740234,40.24285888671875,40.24285888671875,40.24285888671875,40.97142791748047,40.97142791748047,40,40,40,39,39,39,39,40,40,40,40.28571319580078,40.28571319580078,40.900001525878906,40.900001525878906,40.900001525878906,40,40,40.400001525878906,40.400001525878906,40.400001525878906,39,39,39,39,40,40,40,40.28571319580078,40.28571319580078,40.900001525878906,40.900001525878906,40.900001525878906,40,40,40.400001525878906,40.400001525878906,40.400001525878906,39,39,39,39,40,40,40,40.28571319580078,40.28571319580078,40.900001525878906,40.900001525878906,40.900001525878906,40,40,40.400001525878906,40.400001525878906,40.400001525878906,39,39,39,39,40.657142639160156,40.657142639160156,40.657142639160156,40,40,40,40,40,40,40,40.20000076293945,40.20000076293945,40.20000076293945,39,39,39,39,40.657142639160156,40.657142639160156,40.657142639160156,40,40,40,40,40,40,40,40.20000076293945,40.20000076293945,40.20000076293945,39,39,39,39,40.68571472167969,40.68571472167969,40.68571472167969,40.55714416503906,40.55714416503906,40.05714416503906,40.05714416503906,40.05714416503906,40.85714340209961,40.85714340209961,40,40,40,39,39,39,39,40.68571472167969,40.68571472167969,40.68571472167969,40.55714416503906,40.55714416503906,40.05714416503906,40.05714416503906,40.05714416503906,40.85714340209961,40.85714340209961,40,40,40,39,39,39,39,40.68571472167969,40.68571472167969,40.68571472167969,40.55714416503906,40.55714416503906,40.05714416503906,40.05714416503906,40.05714416503906,40.85714340209961,40.85714340209961,40,40,40,39,39,39,39,40.18571472167969,40.18571472167969,40.18571472167969,40.47142791748047,40.47142791748047,40,40,40,40.94285583496094,40.94285583496094,40.94285583496094,40.94285583496094,40.94285583496094,39,39,39,39,40.18571472167969,40.18571472167969,40.18571472167969,40.47142791748047,40.47142791748047,40,40,40,40.94285583496094,40.94285583496094,40.94285583496094,40.94285583496094,40.94285583496094,39,39,39,39,40.400001525878906,40.400001525878906,40.400001525878906,40.67142868041992,40.67142868041992,40,40,40,40.5,40.5,40,40,40,39,39,39,39,40.400001525878906,40.400001525878906,40.400001525878906,40.67142868041992,40.67142868041992,40,40,40,40.5,40.5,40,40,40],"types":[3,3,3,3,0,0,0,0,0,0,0,0,0,0,0,0,0,3,3,3,3,0,0,0,0,0,0,0,0,0,0,0,0,0,3,3,3,3,0,0,0,0,0,0,0,0,0,0,0,0,0,3,3,3,3,0,0,0,0,0,0,0,0,0,0,0,0,0,3,3,3,3,0,0,0,0,0,0,0,0,0,0,0,0,0,3,3,3,3,0,0,0,0,0,0,0,0,0,0,0,0,0,3,3,3,3,0,0,0,0,0,0,0,0,0,0,0,0,0,3,3,3,3,0,0,0,0,0,0,0,0,0,0,0,0,0,3,3,3,3,0,0,0,0,0,0,0,0,0,0,0,0,0,3,3,3,3,0,0,0,0,0,0,0,0,0,0,0,0,0,3,3,3,3,0,0,0,0,0,0,0,0,0,0,0,0,0,3,3,3,3,0,0,0,0,0,0,0,0,0,0,0,0,0,3,3,3,3,0,0,0,0,0,0,0,0,0,0,0,0,0,3,3,3,3,0,0,0,0,0,0,0,0,0,0,0,0,0,3,3,3,3,0,0,0,0,0,0,0,0,0,0,0,0,0,3,3,3,3,0,0,0,0,0,0,0,0,0,0,0,0,0,3,3,3,3,0,0,0,0,0,0,0,0,0,0,0,0,0],"climates":[3,3,3,3,3,3,3,3,3,3,3,3,3,3,3,3,3,3,3,3,3,3,3,3,3,3,3,3,3,3,3,3,3,3,3,3,3,3,3,3,3,3,3,3,3,3,3,3,3,3,3,3,3,3,3,3,3,3,3,3,3,3,3,3,3,3,3,3,3,3,3,3,3,3,3,3,3,3,3,3,3,3,3,3,3,3,3,3,3,3,3,3,3,3,3,3,3,3,3,3,3,3,3,3,3,3,3,3,3,3,3,3,3,3,3,3,3,3,3,3,3,3,3,3,3,3,3,3,3,3,3,3,3,3,3,3,3,3,3,3,3,3,3,3,3,3,3,3,3,3,3,3,3,3,3,3,3,3,3,3,3,3,3,3,3,3,3,3,3,3,3,3,3,3,3,3,3,3,3,3,3,3,3,3,3,3,3,3,3,3,3,3,3,3,3,3,3,3,3,3,3,3,3,3,3,3,3,3,3,3,3,3,3,3,3,3,3,3,3,3,3,3,3,3,3,3,3,3,3,3,3,3,3,3,3,3,3,3,3,3,3,3,3,3,3,3,3,3,3,3,3,3,3,3,3,3,3,3,3,3,3,3,3,3,3,3,3,3,3,3,3,3,3,3,3,3,3,3,3,3,3,3,3,3,3,3,3,3,3],"vegetation":[27.69700050354004,40.33940124511719,11.744999885559082,0.17000000178813934,0.5879999995231628,3.555000066757202,23.007999420166016,40.46034240722656,21.81599998474121,0.3630000054836273,0.15199999511241913,4.072999954223633,10.055000305175781,40.21428680419922,1.0850000381469727,0.9580000042915344,0.38499999046325684,5.645999908447266,28.19499969482422,40.54214096069336,25.149999618530273,0.9739999771118164,0.023000000044703484,2.3329999446868896,15.467000007629395,40.28571319580078,12.586999893188477,0.29600000381469727,0.5180000066757202,0.03999999910593033]},"collision":{"encoding":"x-y-z-flags-structure-height-windows","structures":[],"cells":[]},"interactions":[],"navigation":{"encoding":"symmetric-faces-v1"},"portals":[],"objects":[]}},"children":[{"name":"terrain","source":"./meshes/x016_z020.glb","userData":{"jcrpg":{"kind":"terrain"}}}],"metadata":{"version":0.2,"type":"lewcid_object","camera":{"position":[16,65,48],"rotation":[-0.5,0,0]}}}
