{"name":"seed0_x003_z041.scene.json","userData":{"jcrpg":{"schemaVersion":2,"worldId":"seed0-web-v2","key":"3:41","chunk":[3,41],"bounds":[96,0,1312,128,80,1344],"generatorVersion":"web-baked-v2","terrain":{"heights":[39,39,39,39,39,39,39,39,39,39,39,39,40,40,40,40,40,39,39,39,39,39,39,39,39,39,39,39,39,40,40,40,40,40,39,39,39,39,39,39,39,39,39,39,39,39,40.02000045776367,40.02000045776367,40.02000045776367,40.29999923706055,40.29999923706055,39,39,39,39,39,39,39,39,39,39,39,39,40.02000045776367,40.02000045776367,40.02000045776367,40.29999923706055,40.29999923706055,40.628570556640625,40.628570556640625,40.92856979370117,40.92856979370117,40.92856979370117,40.97142791748047,40.97142791748047,40,40,40,40.28571319580078,40.28571319580078,40,40,40,40.75714111328125,40.75714111328125,40.628570556640625,40.628570556640625,40.92856979370117,40.92856979370117,40.92856979370117,40.97142791748047,40.97142791748047,40,40,40,40.28571319580078,40.28571319580078,40,40,40,40.75714111328125,40.75714111328125,40.628570556640625,40.628570556640625,40.92856979370117,40.92856979370117,40.92856979370117,40.97142791748047,40.97142791748047,40,40,40,40.28571319580078,40.28571319580078,40,40,40,40.75714111328125,40.75714111328125,40,40,40.52857208251953,40.52857208251953,40.52857208251953,40.5,40.5,40.099998474121094,40.099998474121094,40.099998474121094,40.58571243286133,40.58571243286133,40,40,40,40.657142639160156,40.657142639160156,40,40,40.52857208251953,40.52857208251953,40.52857208251953,40.5,40.5,40.099998474121094,40.099998474121094,40.099998474121094,40.58571243286133,40.58571243286133,40,40,40,40.657142639160156,40.657142639160156,40.78571319580078,40.78571319580078,40.20000076293945,40.20000076293945,40.20000076293945,40.24285888671875,40.24285888671875,40,40,40,40,40,40.29999923706055,40.29999923706055,40.29999923706055,40.61428451538086,40.61428451538086,40.78571319580078,40.78571319580078,40.20000076293945,40.20000076293945,40.20000076293945,40.24285888671875,40.24285888671875,40,40,40,40,40,40.29999923706055,40.29999923706055,40.29999923706055,40.61428451538086,40.61428451538086,40.78571319580078,40.78571319580078,40.20000076293945,40.20000076293945,40.20000076293945,40.24285888671875,40.24285888671875,40,40,40,40,40,40.29999923706055,40.29999923706055,40.29999923706055,40.61428451538086,40.61428451538086,40,40,40.31428527832031,40.31428527832031,40.31428527832031,40.82857131958008,40.82857131958008,40,40,40,40.38571548461914,40.38571548461914,40,40,40,40.128570556640625,40.128570556640625,40,40,40.31428527832031,40.31428527832031,40.31428527832031,40.82857131958008,40.82857131958008,40,40,40,40.38571548461914,40.38571548461914,40,40,40,40.128570556640625,40.128570556640625,40,40,40.29999923706055,40.29999923706055,40.29999923706055,40,40,40,40,40,40.5428581237793,40.5428581237793,40.842857360839844,40.842857360839844,40.842857360839844,40,40,40,40,40.29999923706055,40,40,40,40,40,40,40,40.5428581237793,40.5428581237793,40.842857360839844,40.842857360839844,40.842857360839844,40,40,40,40,40.29999923706055,40,40,40,40,40,40,40,40.5428581237793,40.5428581237793,40.842857360839844,40.842857360839844,40.842857360839844,40,40],"types":[3,3,3,3,3,3,3,3,3,3,3,3,1,1,1,1,1,3,3,3,3,3,3,3,3,3,3,3,3,1,1,1,1,1,3,3,3,3,3,3,3,3,3,3,3,3,1,1,1,1,1,3,3,3,3,3,3,3,3,3,3,3,3,1,1,1,1,1,0,0,0,0,0,0,0,0,0,0,0,0,0,0,0,0,0,0,0,0,0,0,0,0,0,0,0,0,0,0,0,0,0,0,0,0,0,0,0,0,0,0,0,0,0,0,0,0,0,0,0,0,0,0,0,0,0,0,0,0,0,0,0,0,0,0,0,0,0,0,0,0,0,0,0,0,0,0,0,0,0,0,0,0,0,0,0,0,0,0,0,0,0,0,0,0,0,0,0,0,0,0,0,0,0,0,0,0,0,0,0,0,0,0,0,0,0,0,0,0,0,0,0,0,0,0,0,0,0,0,0,0,0,0,0,0,0,0,0,0,0,0,0,0,0,0,0,0,0,0,0,0,0,0,0,0,0,0,0,0,0,0,0,0,0,0,0,0,0,0,0,0,0,0,0,0,0,0,0,0,0,0,0,0,0,0,0,0,0,0,0,5,5,0,0,0,0,0,0,0,0,0,0,0,0,0,0,0,5,5,0,0,0,0,0,0,0,0,0,0,0],"climates":[0,0,0,0,0,0,0,0,0,0,0,0,0,0,0,0,0,0,0,0,0,0,0,0,0,0,0,0,0,0,0,0,0,0,0,0,0,0,0,0,0,0,0,0,0,0,0,0,0,0,0,0,0,0,0,0,0,0,0,0,0,0,0,0,0,0,0,0,0,0,0,0,0,0,0,0,0,0,0,0,0,0,0,0,0,0,0,0,0,0,0,0,0,0,0,0,0,0,0,0,0,0,0,0,0,0,0,0,0,0,0,0,0,0,0,0,0,0,0,0,0,0,0,0,0,0,0,0,0,0,0,0,0,0,0,0,0,0,0,0,0,0,0,0,0,0,0,0,0,0,0,0,0,0,0,0,0,0,0,0,0,0,0,0,0,0,0,0,0,0,0,0,0,0,0,0,0,0,0,0,0,0,0,0,0,0,0,0,0,0,0,0,0,0,0,0,0,0,0,0,0,0,0,0,0,0,0,0,0,0,0,0,0,0,0,0,0,0,0,0,0,0,0,0,0,0,0,0,0,0,0,0,0,0,0,0,0,0,0,0,0,0,0,0,0,0,0,0,0,0,0,0,0,0,0,0,0,0,0,0,0,0,0,0,0,0,0,0,0,0,0,0,0,0,0,0,0,0,0,0,0,0,0,0,0,0,0,0,0],"vegetation":[22.695999145507812,40.64725875854492,29.033000946044922,0.9459999799728394,0.11400000005960464,3.434999942779541,26.826000213623047,40.00156021118164,2.1559998989105225,0.3109999895095825,0.3070000112056732,3.6519999504089355,29.790000915527344,40.11507034301758,24.290000915527344,0.6520000100135803,0.8999999761581421,0.9800000190734863,26.457000732421875,40.01374053955078,3.374000072479248,0.37299999594688416,0.5979999899864197,4.9079999923706055,24.06399917602539,40.00130844116211,2.13100004196167,0.07900000363588333,0.8880000114440918,6.00600004196167,24.4060001373291,40,8.444000244140625,0.8700000047683716,0.3930000066757202,4.861000061035156,24.9950008392334,40,14.697999954223633,0.07999999821186066,0.013000000268220901,4.423999786376953,24.166000366210938,40.013999938964844,3.4000000953674316,0.5239999890327454,0.39500001072883606,6.168000221252441,31.643999099731445,40.75714111328125,9.656999588012695,0.8019999861717224,0.8619999885559082,4.2210001945495605,24.408000946044922,40,10.901000022888184,0.4690000116825104,0.6069999933242798,3.131999969482422,24.111000061035156,40.01211929321289,6.788000106811523,0.3400000035762787,0.5960000157356262,3.5260000228881836]},"collision":{"encoding":"x-y-z-flags-structure-height-windows","structures":[{"id":"shrine:shrine 2 33:103:1342","kind":"RoadShrine","origin":[103,40,1342],"size":[4,1,4],"generationVersion":"web-baked-v2"}],"cells":[[7,40,30,1,0,1,0],[8,40,30,1,0,1,0],[9,40,30,1,0,1,0],[10,40,30,1,0,1,0],[7,40,31,1,0,1,0],[8,40,31,1,0,1,0],[9,40,31,1,0,1,0],[10,40,31,1,0,1,0]]},"interactions":[],"navigation":{"encoding":"symmetric-faces-v1"},"portals":[],"objects":[]}},"children":[{"name":"terrain","source":"./meshes/x003_z041.glb","userData":{"jcrpg":{"kind":"terrain"}}},{"name":"stone","position":[7.5,40.02,30.5],"rotation":[0,0,0],"scale":[1,1,1],"source":"../assets/stone.obj","userData":{"jcrpg":{"structureId":"shrine:shrine 2 33:103:1342","realm":"surface"}}},{"name":"stone","position":[8.5,40.02,30.5],"rotation":[0,0,0],"scale":[1,1,1],"source":"../assets/stone.obj","userData":{"jcrpg":{"structureId":"shrine:shrine 2 33:103:1342","realm":"surface"}}},{"name":"stone","position":[9.5,40.02,30.5],"rotation":[0,0,0],"scale":[1,1,1],"source":"../assets/stone.obj","userData":{"jcrpg":{"structureId":"shrine:shrine 2 33:103:1342","realm":"surface"}}},{"name":"stone","position":[10.5,40.02,30.5],"rotation":[0,0,0],"scale":[1,1,1],"source":"../assets/stone.obj","userData":{"jcrpg":{"structureId":"shrine:shrine 2 33:103:1342","realm":"surface"}}},{"name":"stone","position":[7.5,40.02,31.5],"rotation":[0,0,0],"scale":[1,1,1],"source":"../assets/stone.obj","userData":{"jcrpg":{"structureId":"shrine:shrine 2 33:103:1342","realm":"surface"}}},{"name":"stone","position":[8.5,40.02,31.5],"rotation":[0,0,0],"scale":[1,1,1],"source":"../assets/stone.obj","userData":{"jcrpg":{"structureId":"shrine:shrine 2 33:103:1342","realm":"surface"}}},{"name":"stone","position":[9.5,40.02,31.5],"rotation":[0,0,0],"scale":[1,1,1],"source":"../assets/stone.obj","userData":{"jcrpg":{"structureId":"shrine:shrine 2 33:103:1342","realm":"surface"}}},{"name":"stone","position":[10.5,40.02,31.5],"rotation":[0,0,0],"scale":[1,1,1],"source":"../assets/stone.obj","userData":{"jcrpg":{"structureId":"shrine:shrine 2 33:103:1342","realm":"surface"}}}],"metadata":{"version":0.2,"type":"lewcid_object","camera":{"position":[16,65,48],"rotation":[-0.5,0,0]}}}
