{"name":"seed0_x011_z013.scene.json","userData":{"jcrpg":{"schemaVersion":2,"worldId":"seed0-web-v2","key":"11:13","chunk":[11,13],"bounds":[352,0,416,384,80,448],"generatorVersion":"web-baked-v2","terrain":{"heights":[39,39,39,39,39,39,39,39,39,39,39,39,39,39,39,39,39,39,39,39,39,39,39,39,39,39,39,39,39,39,39,39,39,39,39,39,39,39,39,39,39,39,39,39,39,39,39,39,39,39,39,39,39,39,39,39,39,39,39,39,39,39,39,39,39,39,39,39,39,39,39,39,39,39,39,39,39,39,39,39,39,39,39,39,39,39,39,39,39,39,39,39,39,39,39,39,39,39,39,39,39,39,39,39,39,39,39,39,39,39,39,39,39,39,39,39,39,39,39,39,39,39,39,39,39,39,39,39,39,39,39,39,39,39,39,39,39,39,39,39,39,39,39,39,39,39,39,39,39,39,39,39,39,39,39,39,39,39,39,39,39,39,39,39,39,39,39,39,39,39,39,39,39,39,39,39,39,39,39,39,39,39,39,39,39,39,39,39,39,39,39,39,39,39,39,39,39,39,39,39,39,39,39,39,39.36666488647461,39.96666717529297,39.96666717529297,40.78333282470703,40.33333206176758,40.33333206176758,39.79999923706055,39.516666412353516,39.516666412353516,39.766666412353516,40.81666564941406,40.81666564941406,39.849998474121094,39.766666412353516,39.766666412353516,40.21666717529297,39.29999923706055,39.70000076293945,40.13333511352539,40.13333511352539,40.56666564941406,40.71666717529297,40.71666717529297,40.31666564941406,40.41666793823242,40.41666793823242,40.31666564941406,39.391666412353516,39.91666793823242,40.82500076293945,41.54999923706055,41.625,40.93333435058594,40.74166488647461,40.61666488647461,39.849998474121094,39.849998474121094,39.29999923706055,39.650001525878906,39.650001525878906,39.81666564941406,39.93333435058594,39.93333435058594,41.49166488647461,41.86666488647461,42.391666412353516,42.900001525878906,42.19166564941406,42.266666412353516,42.67499923706055,41.599998474121094,41.74166488647461,40,39.849998474121094,39.29999923706055,39.650001525878906,39.650001525878906,39.81666564941406,40.08333206176758,41.05833435058594,42.61666488647461,42.99166488647461,43.516666412353516,44.025001525878906,43.31666564941406,43.391666412353516,43.79999923706055,42.724998474121094,41.78333282470703,40.95833206176758,39.83333206176758,39.349998474121094,39.21666717529297,39.21666717529297,40.349998474121094,40.49166488647461,41.46666717529297,43.15833282470703,44.29999923706055,44.82500076293945,44.099998474121094,44.42499923706055,44.5,44.15833282470703,44.41666793823242],"types":[3,3,3,3,3,3,3,3,3,3,3,3,3,3,3,3,3,3,3,3,3,3,3,3,3,3,3,3,3,3,3,3,3,3,3,3,3,3,3,3,3,3,3,3,3,3,3,3,3,3,3,3,3,3,3,3,3,3,3,3,3,3,3,3,3,3,3,3,3,3,3,3,3,3,3,3,3,3,3,3,3,3,3,3,3,3,3,3,3,3,3,3,3,3,3,3,3,3,3,3,3,3,3,3,3,3,3,3,3,3,3,3,3,3,3,3,3,3,3,3,3,3,3,3,3,3,3,3,3,3,3,3,3,3,3,3,3,3,3,3,3,3,3,3,3,3,3,3,3,3,3,3,3,3,3,3,3,3,3,3,3,3,3,3,3,3,3,3,3,3,3,3,3,3,3,3,3,3,3,3,3,3,3,3,3,3,3,3,3,3,3,3,3,3,3,3,3,3,3,3,3,3,3,3,2,2,2,2,2,2,2,2,2,2,2,2,2,2,2,2,2,2,2,2,2,2,2,2,2,2,2,2,2,2,2,2,2,2,2,2,2,2,2,2,2,2,2,2,2,2,2,2,2,2,2,2,2,2,2,2,2,2,2,2,2,2,2,2,2,2,2,2,2,2,2,2,2,2,2,2,2,2,2,2,2,2,2,2,2],"climates":[0,0,0,0,0,0,0,0,0,0,0,0,0,0,0,0,0,0,0,0,0,0,0,0,0,0,0,0,0,0,0,0,0,0,0,0,0,0,0,0,0,0,0,0,0,0,0,0,0,0,0,0,0,0,0,0,0,0,0,0,0,0,0,0,0,0,0,0,0,0,0,0,0,0,0,0,0,0,0,0,0,0,0,0,0,0,0,0,0,0,0,0,0,0,0,0,0,0,0,0,0,0,0,0,0,0,0,0,0,0,0,0,0,0,0,0,0,0,0,0,0,0,0,0,0,0,0,0,0,0,0,0,0,0,0,0,0,0,0,0,0,0,0,0,0,0,0,0,0,0,0,0,0,0,0,0,0,0,0,0,0,0,0,0,0,0,0,0,0,0,0,0,0,0,0,0,0,0,0,0,0,0,0,0,0,0,0,0,0,0,0,0,0,0,0,0,0,0,0,0,0,0,0,0,2,2,2,2,2,2,2,2,2,2,2,2,2,2,2,2,2,2,2,2,2,2,2,2,2,2,2,2,2,2,2,2,2,2,2,2,2,2,2,2,2,2,2,2,2,2,2,2,2,2,2,2,2,2,2,2,2,2,2,2,2,2,2,2,2,2,2,2,2,2,2,2,2,2,2,2,2,2,2,2,2,2,2,2,2],"vegetation":[18.965999603271484,41.800479888916016,28.226999282836914,0.19099999964237213,0.14399999380111694,0.31700000166893005,30.31599998474121,42.2430305480957,27.698999404907227,0.75,0.5509999990463257,1.815000057220459]},"collision":{"encoding":"x-y-z-flags-structure-height-windows","structures":[{"id":"cave:9:11","kind":"cave","origin":[360,42,440],"size":[40,2,40],"generationVersion":"web-baked-v2"}],"cells":[[24,42,30,2111,0,2,0],[27,42,31,2087,0,2,0],[28,42,31,2063,0,2,0]]},"interactions":[],"navigation":{"encoding":"symmetric-faces-v1"},"portals":[],"objects":[]}},"children":[{"name":"terrain","source":"./meshes/x011_z013.glb","userData":{"jcrpg":{"kind":"terrain"}}},{"name":"caveFloor","position":[24.5,42.015,30.5],"rotation":[0,0,0],"scale":[1,1,1],"source":"../assets/caveFloor.obj","userData":{"jcrpg":{"realm":"cave","structureId":"cave:9:11"}}},{"name":"caveFloor","position":[24.5,44,30.5],"rotation":[0,0,0],"scale":[1,1,1],"source":"../assets/caveFloor.obj","userData":{"jcrpg":{"realm":"cave","structureId":"cave:9:11","ceiling":true}}},{"name":"caveWall","position":[24.5,42,30.000009999999975],"rotation":[0,0,0],"scale":[1,2,1],"source":"../assets/caveWall.obj","userData":{"jcrpg":{"realm":"cave","structureId":"cave:9:11"}}},{"name":"caveWall","position":[24.999990000000025,42,30.5],"rotation":[0,1.5707963267948966,0],"scale":[1,2,1],"source":"../assets/caveWall.obj","userData":{"jcrpg":{"realm":"cave","structureId":"cave:9:11"}}},{"name":"caveWall","position":[24.5,42,30.999990000000025],"rotation":[0,0,0],"scale":[1,2,1],"source":"../assets/caveWall.obj","userData":{"jcrpg":{"realm":"cave","structureId":"cave:9:11"}}},{"name":"caveWall","position":[24.000009999999975,42,30.5],"rotation":[0,1.5707963267948966,0],"scale":[1,2,1],"source":"../assets/caveWall.obj","userData":{"jcrpg":{"realm":"cave","structureId":"cave:9:11"}}},{"name":"caveFloor","position":[27.5,42.015,31.5],"rotation":[0,0,0],"scale":[1,1,1],"source":"../assets/caveFloor.obj","userData":{"jcrpg":{"realm":"cave","structureId":"cave:9:11"}}},{"name":"caveFloor","position":[27.5,44,31.5],"rotation":[0,0,0],"scale":[1,1,1],"source":"../assets/caveFloor.obj","userData":{"jcrpg":{"realm":"cave","structureId":"cave:9:11","ceiling":true}}},{"name":"caveWall","position":[27.5,42,31.000009999999975],"rotation":[0,0,0],"scale":[1,2,1],"source":"../assets/caveWall.obj","userData":{"jcrpg":{"realm":"cave","structureId":"cave:9:11"}}},{"name":"caveWall","position":[27.000009999999975,42,31.5],"rotation":[0,1.5707963267948966,0],"scale":[1,2,1],"source":"../assets/caveWall.obj","userData":{"jcrpg":{"realm":"cave","structureId":"cave:9:11"}}},{"name":"caveFloor","position":[28.5,42.015,31.5],"rotation":[0,0,0],"scale":[1,1,1],"source":"../assets/caveFloor.obj","userData":{"jcrpg":{"realm":"cave","structureId":"cave:9:11"}}},{"name":"caveFloor","position":[28.5,44,31.5],"rotation":[0,0,0],"scale":[1,1,1],"source":"../assets/caveFloor.obj","userData":{"jcrpg":{"realm":"cave","structureId":"cave:9:11","ceiling":true}}},{"name":"caveWall","position":[28.5,42,31.000009999999975],"rotation":[0,0,0],"scale":[1,2,1],"source":"../assets/caveWall.obj","userData":{"jcrpg":{"realm":"cave","structureId":"cave:9:11"}}},{"name":"caveWall","position":[28.999990000000025,42,31.5],"rotation":[0,1.5707963267948966,0],"scale":[1,2,1],"source":"../assets/caveWall.obj","userData":{"jcrpg":{"realm":"cave","structureId":"cave:9:11"}}}],"metadata":{"version":0.2,"type":"lewcid_object","camera":{"position":[16,65,48],"rotation":[-0.5,0,0]}}}
