{"name":"seed0_x008_z013.scene.json","userData":{"jcrpg":{"schemaVersion":2,"worldId":"seed0-web-v2","key":"8:13","chunk":[8,13],"bounds":[256,0,416,288,80,448],"generatorVersion":"web-baked-v2","terrain":{"heights":[39,39,39,39,39,39,39,39,39,39,39,39,40.25714111328125,40.25714111328125,40.25714111328125,40.871429443359375,40.871429443359375,39,39,39,39,39,39,39,39,39,39,39,39,40.25714111328125,40.25714111328125,40.25714111328125,40.871429443359375,40.871429443359375,39,39,39,39,39,39,39,39,39,39,39,39,40.42856979370117,40.42856979370117,40.42856979370117,40.342857360839844,40.342857360839844,39,39,39,39,39,39,39,39,39,39,39,39,40.42856979370117,40.42856979370117,40.42856979370117,40.342857360839844,40.342857360839844,39,39,39,39,39,39,39,39,39,39,39,39,40.42856979370117,40.42856979370117,40.42856979370117,40.342857360839844,40.342857360839844,39,39,39,39,39,39,39,39,39,39,39,39,40.70000076293945,40.70000076293945,40.70000076293945,40.400001525878906,40.400001525878906,39,39,39,39,39,39,39,39,39,39,39,39,40.70000076293945,40.70000076293945,40.70000076293945,40.400001525878906,40.400001525878906,39,39,39,39,39,39,39,39,39,39,39,39,40,40,40,40.64285659790039,40.64285659790039,39,39,39,39,39,39,39,39,39,39,39,39,40,40,40,40.64285659790039,40.64285659790039,39,39,39,39,39,39,39,39,39,39,39,39,40,40,40,40.64285659790039,40.64285659790039,39,39,39,39,39,39,39,39,39,39,39,39,40.78571319580078,40.78571319580078,40.78571319580078,40.02857208251953,40.02857208251953,39,39,39,39,39,39,39,39,39,39,39,39,40.78571319580078,40.78571319580078,40.78571319580078,40.02857208251953,40.02857208251953,39,39,39,39,39,39,39,39,39,39,39,39,39,39,39,39,39,39,39,39,39,39,39,39,39,39,39,39,39,39,39,39,39,39,39,39,39,39,39,39,39,39,39,39,39,39,39,39,39,39,39,39,39,39,39,39,39,39,39,39,39,39,39,39,39,39,39,39,39,39,39,39,39,39,39,39,39,39,39,39,39,39,39,39,39],"types":[4,4,4,4,4,4,4,4,4,4,4,4,0,0,0,0,0,4,4,4,4,4,4,4,4,4,4,4,4,0,0,0,0,0,4,4,4,4,4,4,4,4,4,4,4,4,0,0,0,0,0,4,4,4,4,4,4,4,4,4,4,4,4,0,0,0,0,0,4,4,4,4,4,4,4,4,4,4,4,4,0,0,0,0,0,4,4,4,4,4,4,4,4,4,4,4,4,0,0,0,0,0,4,4,4,4,4,4,4,4,4,4,4,4,0,0,0,0,0,4,4,4,4,4,4,4,4,4,4,4,4,0,0,0,0,0,4,4,4,4,4,4,4,4,4,4,4,4,0,0,0,0,0,4,4,4,4,4,4,4,4,4,4,4,4,0,0,0,0,0,4,4,4,4,4,4,4,4,4,4,4,4,0,0,0,0,0,4,4,4,4,4,4,4,4,4,4,4,4,0,0,0,0,0,3,3,3,3,3,3,3,3,3,3,3,3,3,3,3,3,3,3,3,3,3,3,3,3,3,3,3,3,3,3,3,3,3,3,3,3,3,3,3,3,3,3,3,3,3,3,3,3,3,3,3,3,3,3,3,3,3,3,3,3,3,3,3,3,3,3,3,3,3,3,3,3,3,3,3,3,3,3,3,3,3,3,3,3,3],"climates":[0,0,0,0,0,0,0,0,0,0,0,0,0,0,0,0,0,0,0,0,0,0,0,0,0,0,0,0,0,0,0,0,0,0,0,0,0,0,0,0,0,0,0,0,0,0,0,0,0,0,0,0,0,0,0,0,0,0,0,0,0,0,0,0,0,0,0,0,0,0,0,0,0,0,0,0,0,0,0,0,0,0,0,0,0,0,0,0,0,0,0,0,0,0,0,0,0,0,0,0,0,0,0,0,0,0,0,0,0,0,0,0,0,0,0,0,0,0,0,0,0,0,0,0,0,0,0,0,0,0,0,0,0,0,0,0,0,0,0,0,0,0,0,0,0,0,0,0,0,0,0,0,0,0,0,0,0,0,0,0,0,0,0,0,0,0,0,0,0,0,0,0,0,0,0,0,0,0,0,0,0,0,0,0,0,0,0,0,0,0,0,0,0,0,0,0,0,0,0,0,0,0,0,0,2,2,2,2,2,2,2,2,2,2,2,2,2,2,2,2,2,2,2,2,2,2,2,2,2,2,2,2,2,2,2,2,2,2,2,2,2,2,2,2,2,2,2,2,2,2,2,2,2,2,2,2,2,2,2,2,2,2,2,2,2,2,2,2,2,2,2,2,2,2,2,2,2,2,2,2,2,2,2,2,2,2,2,2,2],"vegetation":[29.04599952697754,40.33621597290039,17.385000228881836,0.8980000019073486,0.6830000281333923,5.10099983215332,25.615999221801758,39.91071319580078,22.979999542236328,0.012000000104308128,0.38199999928474426,0.5400000214576721]},"collision":{"encoding":"x-y-z-flags-structure-height-windows","structures":[],"cells":[]},"interactions":[{"id":"interaction:actor:legacy-actor:HumanCommoners#114:166","kind":"actor","targetId":"legacy-actor:HumanCommoners#114:166","position":[260.5,39,420.5],"realm":"surface","range":2.1,"priority":70,"prompt":"Talk to Resident 166","requiresLineOfSight":true,"settlementId":"town:populationHumanCommoners#114"}],"navigation":{"encoding":"symmetric-faces-v1"},"portals":[],"objects":[]}},"children":[{"name":"terrain","source":"./meshes/x008_z013.glb","userData":{"jcrpg":{"kind":"terrain"}}},{"name":"actor_human","position":[4.5,39,4.5],"rotation":[0,0,0],"scale":[1,1,1],"source":"../assets/actor_human.obj","userData":{"jcrpg":{"realm":"surface","interactionId":"interaction:actor:legacy-actor:HumanCommoners#114:166","stateTargetId":"legacy-actor:HumanCommoners#114:166","actorId":"legacy-actor:HumanCommoners#114:166","settlementId":"town:populationHumanCommoners#114"}}}],"metadata":{"version":0.2,"type":"lewcid_object","camera":{"position":[16,65,48],"rotation":[-0.5,0,0]}}}
