{"name":"region_2_0","userData":{"jcrpg":{"schemaVersion":2,"worldId":"seed0-web-v2","region":[2,0]}},"children":[{"name":"chunk_0_0","position":[0,0,0],"source":"../chunks/x010_z000.scene.json"},{"name":"chunk_1_0","position":[32,0,0],"source":"../chunks/x011_z000.scene.json"},{"name":"chunk_2_0","position":[64,0,0],"source":"../chunks/x012_z000.scene.json"},{"name":"chunk_3_0","position":[96,0,0],"source":"../chunks/x013_z000.scene.json"},{"name":"chunk_4_0","position":[128,0,0],"source":"../chunks/x014_z000.scene.json"},{"name":"chunk_0_1","position":[0,0,32],"source":"../chunks/x010_z001.scene.json"},{"name":"chunk_1_1","position":[32,0,32],"source":"../chunks/x011_z001.scene.json"},{"name":"chunk_2_1","position":[64,0,32],"source":"../chunks/x012_z001.scene.json"},{"name":"chunk_3_1","position":[96,0,32],"source":"../chunks/x013_z001.scene.json"},{"name":"chunk_4_1","position":[128,0,32],"source":"../chunks/x014_z001.scene.json"},{"name":"chunk_0_2","position":[0,0,64],"source":"../chunks/x010_z002.scene.json"},{"name":"chunk_1_2","position":[32,0,64],"source":"../chunks/x011_z002.scene.json"},{"name":"chunk_2_2","position":[64,0,64],"source":"../chunks/x012_z002.scene.json"},{"name":"chunk_3_2","position":[96,0,64],"source":"../chunks/x013_z002.scene.json"},{"name":"chunk_4_2","position":[128,0,64],"source":"../chunks/x014_z002.scene.json"},{"name":"chunk_0_3","position":[0,0,96],"source":"../chunks/x010_z003.scene.json"},{"name":"chunk_1_3","position":[32,0,96],"source":"../chunks/x011_z003.scene.json"},{"name":"chunk_2_3","position":[64,0,96],"source":"../chunks/x012_z003.scene.json"},{"name":"chunk_3_3","position":[96,0,96],"source":"../chunks/x013_z003.scene.json"},{"name":"chunk_4_3","position":[128,0,96],"source":"../chunks/x014_z003.scene.json"},{"name":"chunk_0_4","position":[0,0,128],"source":"../chunks/x010_z004.scene.json"},{"name":"chunk_1_4","position":[32,0,128],"source":"../chunks/x011_z004.scene.json"},{"name":"chunk_2_4","position":[64,0,128],"source":"../chunks/x012_z004.scene.json"},{"name":"chunk_3_4","position":[96,0,128],"source":"../chunks/x013_z004.scene.json"},{"name":"chunk_4_4","position":[128,0,128],"source":"../chunks/x014_z004.scene.json"}],"metadata":{"version":0.2,"type":"lewcid_object","camera":{"position":[80,160,220],"rotation":[-0.6,0,0]}}}
