{"name":"Shared model","userData":{"jcrpg":{"schemaVersion":2,"worldId":"seed0-web-v2","kind":"prefab"}},"children":[{"name":"floor","position":[0.5,0.015000000000000568,0.5],"rotation":[0,0,0],"scale":[1,1,1],"source":"./floor.obj","userData":{"jcrpg":{"realm":"surface"}}},{"name":"floor","position":[0.5,1,0.5],"rotation":[0,0,0],"scale":[1,1,1],"source":"./floor.obj","userData":{"jcrpg":{"realm":"surface","ceiling":true}}},{"name":"iglooWall","position":[0.5,0,0.000009999999974752427],"rotation":[0,0,0],"scale":[1,1,1],"source":"./iglooWall.obj","userData":{"jcrpg":{"realm":"surface"}}},{"name":"iglooWall","position":[0.000009999999974752427,0,0.5],"rotation":[0,1.5707963267948966,0],"scale":[1,1,1],"source":"./iglooWall.obj","userData":{"jcrpg":{"realm":"surface"}}},{"name":"floor","position":[1.5,0.015000000000000568,0.5],"rotation":[0,0,0],"scale":[1,1,1],"source":"./floor.obj","userData":{"jcrpg":{"realm":"surface"}}},{"name":"floor","position":[1.5,1,0.5],"rotation":[0,0,0],"scale":[1,1,1],"source":"./floor.obj","userData":{"jcrpg":{"realm":"surface","ceiling":true}}},{"name":"iglooWall","position":[1.5,0,0.000009999999974752427],"rotation":[0,0,0],"scale":[1,1,1],"source":"./iglooWall.obj","userData":{"jcrpg":{"realm":"surface"}}},{"name":"floor","position":[2.5,0.015000000000000568,0.5],"rotation":[0,0,0],"scale":[1,1,1],"source":"./floor.obj","userData":{"jcrpg":{"realm":"surface"}}},{"name":"floor","position":[2.5,1,0.5],"rotation":[0,0,0],"scale":[1,1,1],"source":"./floor.obj","userData":{"jcrpg":{"realm":"surface","ceiling":true}}},{"name":"iglooWall","position":[2.5,0,0.000009999999974752427],"rotation":[0,0,0],"scale":[1,1,1],"source":"./iglooWall.obj","userData":{"jcrpg":{"realm":"surface"}}},{"name":"floor","position":[3.5,0.015000000000000568,0.5],"rotation":[0,0,0],"scale":[1,1,1],"source":"./floor.obj","userData":{"jcrpg":{"realm":"surface"}}},{"name":"floor","position":[3.5,1,0.5],"rotation":[0,0,0],"scale":[1,1,1],"source":"./floor.obj","userData":{"jcrpg":{"realm":"surface","ceiling":true}}},{"name":"iglooWall","position":[3.5,0,0.000009999999974752427],"rotation":[0,0,0],"scale":[1,1,1],"source":"./iglooWall.obj","userData":{"jcrpg":{"realm":"surface"}}},{"name":"iglooWall","position":[3.9999900000000252,0,0.5],"rotation":[0,1.5707963267948966,0],"scale":[1,1,1],"source":"./iglooWall.obj","userData":{"jcrpg":{"realm":"surface"}}},{"name":"floor","position":[0.5,0.015000000000000568,1.5],"rotation":[0,0,0],"scale":[1,1,1],"source":"./floor.obj","userData":{"jcrpg":{"realm":"surface"}}},{"name":"floor","position":[0.5,1,1.5],"rotation":[0,0,0],"scale":[1,1,1],"source":"./floor.obj","userData":{"jcrpg":{"realm":"surface","ceiling":true}}},{"name":"door","position":[0.000009999999974752427,0,1.5],"rotation":[0,1.5707963267948966,0],"scale":[1,1,1],"source":"./door.obj","userData":{"jcrpg":{"realm":"surface"}}},{"name":"floor","position":[1.5,0.015000000000000568,1.5],"rotation":[0,0,0],"scale":[1,1,1],"source":"./floor.obj","userData":{"jcrpg":{"realm":"surface"}}},{"name":"floor","position":[1.5,1,1.5],"rotation":[0,0,0],"scale":[1,1,1],"source":"./floor.obj","userData":{"jcrpg":{"realm":"surface","ceiling":true}}},{"name":"floor","position":[2.5,0.015000000000000568,1.5],"rotation":[0,0,0],"scale":[1,1,1],"source":"./floor.obj","userData":{"jcrpg":{"realm":"surface"}}},{"name":"floor","position":[2.5,1,1.5],"rotation":[0,0,0],"scale":[1,1,1],"source":"./floor.obj","userData":{"jcrpg":{"realm":"surface","ceiling":true}}},{"name":"floor","position":[3.5,0.015000000000000568,1.5],"rotation":[0,0,0],"scale":[1,1,1],"source":"./floor.obj","userData":{"jcrpg":{"realm":"surface"}}},{"name":"floor","position":[3.5,1,1.5],"rotation":[0,0,0],"scale":[1,1,1],"source":"./floor.obj","userData":{"jcrpg":{"realm":"surface","ceiling":true}}},{"name":"door","position":[3.9999900000000252,0,1.5],"rotation":[0,1.5707963267948966,0],"scale":[1,1,1],"source":"./door.obj","userData":{"jcrpg":{"realm":"surface"}}},{"name":"floor","position":[0.5,0.015000000000000568,2.5],"rotation":[0,0,0],"scale":[1,1,1],"source":"./floor.obj","userData":{"jcrpg":{"realm":"surface"}}},{"name":"floor","position":[0.5,1,2.5],"rotation":[0,0,0],"scale":[1,1,1],"source":"./floor.obj","userData":{"jcrpg":{"realm":"surface","ceiling":true}}},{"name":"iglooWall","position":[0.000009999999974752427,0,2.5],"rotation":[0,1.5707963267948966,0],"scale":[1,1,1],"source":"./iglooWall.obj","userData":{"jcrpg":{"realm":"surface"}}},{"name":"floor","position":[1.5,0.015000000000000568,2.5],"rotation":[0,0,0],"scale":[1,1,1],"source":"./floor.obj","userData":{"jcrpg":{"realm":"surface"}}},{"name":"floor","position":[1.5,1,2.5],"rotation":[0,0,0],"scale":[1,1,1],"source":"./floor.obj","userData":{"jcrpg":{"realm":"surface","ceiling":true}}},{"name":"floor","position":[2.5,0.015000000000000568,2.5],"rotation":[0,0,0],"scale":[1,1,1],"source":"./floor.obj","userData":{"jcrpg":{"realm":"surface"}}},{"name":"floor","position":[2.5,1,2.5],"rotation":[0,0,0],"scale":[1,1,1],"source":"./floor.obj","userData":{"jcrpg":{"realm":"surface","ceiling":true}}},{"name":"floor","position":[3.5,0.015000000000000568,2.5],"rotation":[0,0,0],"scale":[1,1,1],"source":"./floor.obj","userData":{"jcrpg":{"realm":"surface"}}},{"name":"floor","position":[3.5,1,2.5],"rotation":[0,0,0],"scale":[1,1,1],"source":"./floor.obj","userData":{"jcrpg":{"realm":"surface","ceiling":true}}},{"name":"iglooWall","position":[3.9999900000000252,0,2.5],"rotation":[0,1.5707963267948966,0],"scale":[1,1,1],"source":"./iglooWall.obj","userData":{"jcrpg":{"realm":"surface"}}},{"name":"floor","position":[0.5,0.015000000000000568,3.5],"rotation":[0,0,0],"scale":[1,1,1],"source":"./floor.obj","userData":{"jcrpg":{"realm":"surface"}}},{"name":"floor","position":[0.5,1,3.5],"rotation":[0,0,0],"scale":[1,1,1],"source":"./floor.obj","userData":{"jcrpg":{"realm":"surface","ceiling":true}}},{"name":"iglooWall","position":[0.5,0,3.9999900000000252],"rotation":[0,0,0],"scale":[1,1,1],"source":"./iglooWall.obj","userData":{"jcrpg":{"realm":"surface"}}},{"name":"iglooWall","position":[0.000009999999974752427,0,3.5],"rotation":[0,1.5707963267948966,0],"scale":[1,1,1],"source":"./iglooWall.obj","userData":{"jcrpg":{"realm":"surface"}}},{"name":"floor","position":[1.5,0.015000000000000568,3.5],"rotation":[0,0,0],"scale":[1,1,1],"source":"./floor.obj","userData":{"jcrpg":{"realm":"surface"}}},{"name":"floor","position":[1.5,1,3.5],"rotation":[0,0,0],"scale":[1,1,1],"source":"./floor.obj","userData":{"jcrpg":{"realm":"surface","ceiling":true}}},{"name":"iglooWall","position":[1.5,0,3.9999900000000252],"rotation":[0,0,0],"scale":[1,1,1],"source":"./iglooWall.obj","userData":{"jcrpg":{"realm":"surface"}}},{"name":"floor","position":[2.5,0.015000000000000568,3.5],"rotation":[0,0,0],"scale":[1,1,1],"source":"./floor.obj","userData":{"jcrpg":{"realm":"surface"}}},{"name":"floor","position":[2.5,1,3.5],"rotation":[0,0,0],"scale":[1,1,1],"source":"./floor.obj","userData":{"jcrpg":{"realm":"surface","ceiling":true}}},{"name":"iglooWall","position":[2.5,0,3.9999900000000252],"rotation":[0,0,0],"scale":[1,1,1],"source":"./iglooWall.obj","userData":{"jcrpg":{"realm":"surface"}}},{"name":"floor","position":[3.5,0.015000000000000568,3.5],"rotation":[0,0,0],"scale":[1,1,1],"source":"./floor.obj","userData":{"jcrpg":{"realm":"surface"}}},{"name":"floor","position":[3.5,1,3.5],"rotation":[0,0,0],"scale":[1,1,1],"source":"./floor.obj","userData":{"jcrpg":{"realm":"surface","ceiling":true}}},{"name":"iglooWall","position":[3.9999900000000252,0,3.5],"rotation":[0,1.5707963267948966,0],"scale":[1,1,1],"source":"./iglooWall.obj","userData":{"jcrpg":{"realm":"surface"}}},{"name":"iglooWall","position":[3.5,0,3.9999900000000252],"rotation":[0,0,0],"scale":[1,1,1],"source":"./iglooWall.obj","userData":{"jcrpg":{"realm":"surface"}}},{"name":"iglooRoof","position":[2,1,2],"rotation":[0,0,0],"scale":[1,1,1],"source":"./iglooRoof.obj","userData":{"jcrpg":{"roof":true,"realm":"surface"}}},{"name":"bookcase","position":[1.5,0,0.20000000000004547],"rotation":[0,0,0],"scale":[1,1,1],"source":"./bookcase.obj","userData":{"jcrpg":{"objectId":null,"realm":"surface"}}}],"metadata":{"version":0.2,"type":"lewcid_object","camera":{"position":[16,65,48],"rotation":[-0.5,0,0]}}}
