{"name":"Shared model","userData":{"jcrpg":{"schemaVersion":2,"worldId":"seed0-web-v2","kind":"prefab"}},"children":[{"name":"floor","position":[0.5,0.015000000000000568,0.5],"rotation":[0,0,0],"scale":[1,1,1],"source":"./floor.obj","userData":{"jcrpg":{"realm":"surface"}}},{"name":"floor","position":[0.5,1,0.5],"rotation":[0,0,0],"scale":[1,1,1],"source":"./floor.obj","userData":{"jcrpg":{"realm":"surface","ceiling":true}}},{"name":"wall","position":[0.5,0,0.000009999999974752427],"rotation":[0,0,0],"scale":[1,1,1],"source":"./wall.obj","userData":{"jcrpg":{"realm":"surface"}}},{"name":"wall","position":[0.000010000000003174137,0,0.5],"rotation":[0,1.5707963267948966,0],"scale":[1,1,1],"source":"./wall.obj","userData":{"jcrpg":{"realm":"surface"}}},{"name":"floor","position":[1.5,0.015000000000000568,0.5],"rotation":[0,0,0],"scale":[1,1,1],"source":"./floor.obj","userData":{"jcrpg":{"realm":"surface"}}},{"name":"floor","position":[1.5,1,0.5],"rotation":[0,0,0],"scale":[1,1,1],"source":"./floor.obj","userData":{"jcrpg":{"realm":"surface","ceiling":true}}},{"name":"wall","position":[1.5,0,0.000009999999974752427],"rotation":[0,0,0],"scale":[1,1,1],"source":"./wall.obj","userData":{"jcrpg":{"realm":"surface"}}},{"name":"floor","position":[2.5,0.015000000000000568,0.5],"rotation":[0,0,0],"scale":[1,1,1],"source":"./floor.obj","userData":{"jcrpg":{"realm":"surface"}}},{"name":"floor","position":[2.5,1,0.5],"rotation":[0,0,0],"scale":[1,1,1],"source":"./floor.obj","userData":{"jcrpg":{"realm":"surface","ceiling":true}}},{"name":"window","position":[2.5,0,0.000009999999974752427],"rotation":[0,0,0],"scale":[1,1,1],"source":"./window.obj","userData":{"jcrpg":{"realm":"surface"}}},{"name":"floor","position":[3.5,0.015000000000000568,0.5],"rotation":[0,0,0],"scale":[1,1,1],"source":"./floor.obj","userData":{"jcrpg":{"realm":"surface"}}},{"name":"floor","position":[3.5,1,0.5],"rotation":[0,0,0],"scale":[1,1,1],"source":"./floor.obj","userData":{"jcrpg":{"realm":"surface","ceiling":true}}},{"name":"wall","position":[3.5,0,0.000009999999974752427],"rotation":[0,0,0],"scale":[1,1,1],"source":"./wall.obj","userData":{"jcrpg":{"realm":"surface"}}},{"name":"wall","position":[3.999989999999997,0,0.5],"rotation":[0,1.5707963267948966,0],"scale":[1,1,1],"source":"./wall.obj","userData":{"jcrpg":{"realm":"surface"}}},{"name":"floor","position":[0.5,0.015000000000000568,1.5],"rotation":[0,0,0],"scale":[1,1,1],"source":"./floor.obj","userData":{"jcrpg":{"realm":"surface"}}},{"name":"floor","position":[0.5,1,1.5],"rotation":[0,0,0],"scale":[1,1,1],"source":"./floor.obj","userData":{"jcrpg":{"realm":"surface","ceiling":true}}},{"name":"wall","position":[0.000010000000003174137,0,1.5],"rotation":[0,1.5707963267948966,0],"scale":[1,1,1],"source":"./wall.obj","userData":{"jcrpg":{"realm":"surface"}}},{"name":"floor","position":[1.5,0.015000000000000568,1.5],"rotation":[0,0,0],"scale":[1,1,1],"source":"./floor.obj","userData":{"jcrpg":{"realm":"surface"}}},{"name":"floor","position":[1.5,1,1.5],"rotation":[0,0,0],"scale":[1,1,1],"source":"./floor.obj","userData":{"jcrpg":{"realm":"surface","ceiling":true}}},{"name":"floor","position":[2.5,0.015000000000000568,1.5],"rotation":[0,0,0],"scale":[1,1,1],"source":"./floor.obj","userData":{"jcrpg":{"realm":"surface"}}},{"name":"floor","position":[2.5,1,1.5],"rotation":[0,0,0],"scale":[1,1,1],"source":"./floor.obj","userData":{"jcrpg":{"realm":"surface","ceiling":true}}},{"name":"floor","position":[3.5,0.015000000000000568,1.5],"rotation":[0,0,0],"scale":[1,1,1],"source":"./floor.obj","userData":{"jcrpg":{"realm":"surface"}}},{"name":"floor","position":[3.5,1,1.5],"rotation":[0,0,0],"scale":[1,1,1],"source":"./floor.obj","userData":{"jcrpg":{"realm":"surface","ceiling":true}}},{"name":"door","position":[3.999989999999997,0,1.5],"rotation":[0,1.5707963267948966,0],"scale":[1,1,1],"source":"./door.obj","userData":{"jcrpg":{"realm":"surface"}}},{"name":"floor","position":[0.5,0.015000000000000568,2.5],"rotation":[0,0,0],"scale":[1,1,1],"source":"./floor.obj","userData":{"jcrpg":{"realm":"surface"}}},{"name":"floor","position":[0.5,1,2.5],"rotation":[0,0,0],"scale":[1,1,1],"source":"./floor.obj","userData":{"jcrpg":{"realm":"surface","ceiling":true}}},{"name":"window","position":[0.000010000000003174137,0,2.5],"rotation":[0,1.5707963267948966,0],"scale":[1,1,1],"source":"./window.obj","userData":{"jcrpg":{"realm":"surface"}}},{"name":"floor","position":[1.5,0.015000000000000568,2.5],"rotation":[0,0,0],"scale":[1,1,1],"source":"./floor.obj","userData":{"jcrpg":{"realm":"surface"}}},{"name":"floor","position":[1.5,1,2.5],"rotation":[0,0,0],"scale":[1,1,1],"source":"./floor.obj","userData":{"jcrpg":{"realm":"surface","ceiling":true}}},{"name":"floor","position":[2.5,0.015000000000000568,2.5],"rotation":[0,0,0],"scale":[1,1,1],"source":"./floor.obj","userData":{"jcrpg":{"realm":"surface"}}},{"name":"floor","position":[2.5,1,2.5],"rotation":[0,0,0],"scale":[1,1,1],"source":"./floor.obj","userData":{"jcrpg":{"realm":"surface","ceiling":true}}},{"name":"floor","position":[3.5,0.015000000000000568,2.5],"rotation":[0,0,0],"scale":[1,1,1],"source":"./floor.obj","userData":{"jcrpg":{"realm":"surface"}}},{"name":"floor","position":[3.5,1,2.5],"rotation":[0,0,0],"scale":[1,1,1],"source":"./floor.obj","userData":{"jcrpg":{"realm":"surface","ceiling":true}}},{"name":"window","position":[3.999989999999997,0,2.5],"rotation":[0,1.5707963267948966,0],"scale":[1,1,1],"source":"./window.obj","userData":{"jcrpg":{"realm":"surface"}}},{"name":"floor","position":[0.5,0.015000000000000568,3.5],"rotation":[0,0,0],"scale":[1,1,1],"source":"./floor.obj","userData":{"jcrpg":{"realm":"surface"}}},{"name":"floor","position":[0.5,1,3.5],"rotation":[0,0,0],"scale":[1,1,1],"source":"./floor.obj","userData":{"jcrpg":{"realm":"surface","ceiling":true}}},{"name":"wall","position":[0.5,0,3.9999900000000252],"rotation":[0,0,0],"scale":[1,1,1],"source":"./wall.obj","userData":{"jcrpg":{"realm":"surface"}}},{"name":"wall","position":[0.000010000000003174137,0,3.5],"rotation":[0,1.5707963267948966,0],"scale":[1,1,1],"source":"./wall.obj","userData":{"jcrpg":{"realm":"surface"}}},{"name":"floor","position":[1.5,0.015000000000000568,3.5],"rotation":[0,0,0],"scale":[1,1,1],"source":"./floor.obj","userData":{"jcrpg":{"realm":"surface"}}},{"name":"floor","position":[1.5,1,3.5],"rotation":[0,0,0],"scale":[1,1,1],"source":"./floor.obj","userData":{"jcrpg":{"realm":"surface","ceiling":true}}},{"name":"wall","position":[1.5,0,3.9999900000000252],"rotation":[0,0,0],"scale":[1,1,1],"source":"./wall.obj","userData":{"jcrpg":{"realm":"surface"}}},{"name":"floor","position":[2.5,0.015000000000000568,3.5],"rotation":[0,0,0],"scale":[1,1,1],"source":"./floor.obj","userData":{"jcrpg":{"realm":"surface"}}},{"name":"floor","position":[2.5,1,3.5],"rotation":[0,0,0],"scale":[1,1,1],"source":"./floor.obj","userData":{"jcrpg":{"realm":"surface","ceiling":true}}},{"name":"window","position":[2.5,0,3.9999900000000252],"rotation":[0,0,0],"scale":[1,1,1],"source":"./window.obj","userData":{"jcrpg":{"realm":"surface"}}},{"name":"floor","position":[3.5,0.015000000000000568,3.5],"rotation":[0,0,0],"scale":[1,1,1],"source":"./floor.obj","userData":{"jcrpg":{"realm":"surface"}}},{"name":"floor","position":[3.5,1,3.5],"rotation":[0,0,0],"scale":[1,1,1],"source":"./floor.obj","userData":{"jcrpg":{"realm":"surface","ceiling":true}}},{"name":"wall","position":[3.999989999999997,0,3.5],"rotation":[0,1.5707963267948966,0],"scale":[1,1,1],"source":"./wall.obj","userData":{"jcrpg":{"realm":"surface"}}},{"name":"wall","position":[3.5,0,3.9999900000000252],"rotation":[0,0,0],"scale":[1,1,1],"source":"./wall.obj","userData":{"jcrpg":{"realm":"surface"}}},{"name":"bookcase","position":[1.5,0,0.20000000000004547],"rotation":[0,0,0],"scale":[1,1,1],"source":"./bookcase.obj","userData":{"jcrpg":{"objectId":null,"realm":"surface"}}},{"name":"Shared roof","position":[0,0,0],"source":"./shared-roof-55642c0fb7315746.scene.json","userData":{"jcrpg":{}}}],"metadata":{"version":0.2,"type":"lewcid_object","camera":{"position":[16,65,48],"rotation":[-0.5,0,0]}}}
